{
  "manifest_version": "1.0.0",
  "manifest_id": "unsafe-seed",
  "study_id": "study",
  "protocol_version": "1.0.0",
  "cognit_commit": "0123456789abcdef0123456789abcdef01234567",
  "created_at": "2026-10-22T12:00:00Z",
  "environment": {
    "browser": "Chromium",
    "browser_version": "130",
    "os": "Linux",
    "os_version": "6"
  },
  "actor": {
    "type": "UNKNOWN",
    "version": "UNKNOWN"
  },
  "challenge_set": {
    "id": "choice-v1",
    "version": "1.0.0"
  },
  "seed": 9007199254740992,
  "config": {},
  "config_sha256": "44136fa355b3678a1146ad16f7e8649e94fb4fc21fe77e8310c060f61caaff8a",
  "accessible_mode": "STANDARD",
  "evidence_class": "SIMULATED",
  "result": "UNKNOWN",
  "observations": [],
  "manifest_sha256": "7d5e93e558d42fc1809a51cb50f1f53a749cf43a3783e149eaa21334ae5bc746"
}
