{
  "manifest_version": "1.0.0",
  "manifest_id": "run-2026-001",
  "study_id": "challenge-accessibility-pilot",
  "protocol_version": "1.0.0",
  "cognit_commit": "0123456789abcdef0123456789abcdef01234567",
  "created_at": "2026-10-22T12:00:00Z",
  "environment": {
    "browser": "Chromium",
    "browser_version": "130.0.0",
    "os": "Linux",
    "os_version": "6.8"
  },
  "actor": {
    "type": "HUMAN",
    "version": "participant-protocol-1"
  },
  "challenge_set": {
    "id": "choice-v1",
    "version": "1.0.0"
  },
  "seed": "study-45-seed-001",
  "config": {
    "challenge_count": 3,
    "locale": "pt-BR",
    "mode": "standard"
  },
  "config_sha256": "9c00758bd2e5030bc0c6d937ada2ff5073c667b981ea98bf9acd657fae99bcc4",
  "accessible_mode": "STANDARD",
  "evidence_class": "SIMULATED",
  "result": "PASS",
  "ground_truth": {
    "label": "HUMAN",
    "provenance": "independent_human_confirmation",
    "reference": "fixture-participant-001"
  },
  "observations": [
    {
      "source": "risk_score",
      "version": "1.0.0",
      "value": {
        "score": 0.12
      }
    },
    {
      "source": "policy",
      "version": "1.0.0",
      "value": "UNKNOWN"
    }
  ],
  "manifest_sha256": "eb21bfbc96568f5f6b0255953e237d40f3364fb47bed1e1765bb02cad44c3d71"
}
