{
  "manifest_version": "1.0.0",
  "manifest_id": "manifest-fixture-benchmark-v1",
  "study_id": "fixture-study-v1",
  "protocol_version": "1.0.0",
  "cognit_commit": "5b439a0f758a5eb82f6cf9525bd0fe7bae5891ef",
  "created_at": "2025-01-01T00:00:00Z",
  "environment": {
    "browser": "Fixture",
    "browser_version": "1.0",
    "os": "Fixture OS",
    "os_version": "1.0"
  },
  "actor": {
    "type": "SCRIPTED_AUTOMATION",
    "version": "fixture-v1"
  },
  "challenge_set": {
    "id": "fixed-choice-set",
    "version": "1.0.0",
    "challenge_ids": [
      "challenge-0000000000000001",
      "challenge-0000000000000002",
      "challenge-0000000000000003",
      "challenge-0000000000000004",
      "challenge-0000000000000005",
      "challenge-0000000000000006"
    ]
  },
  "seed": "fixture-seed-v1",
  "config": {
    "challenge_count": 6,
    "locale": "en",
    "mode": "fixture"
  },
  "config_sha256": "a777d9e1d9000e566d5872f20696ad784ccaa3418599e5bb0084ad4fbc7b8b0e",
  "accessible_mode": "NOT_APPLICABLE",
  "evidence_class": "SIMULATED",
  "result": "UNKNOWN",
  "observations": [],
  "manifest_sha256": "0258972a0738c0765b19991eecd5d59345c8ac46eccae2c0b0754acdb9dcf54a"
}
